"Prefixed_Name","Full_Name","First_Name","Surname","Position"
"Mr","นายสุรเดช เกียรติธนากร","สุรเดช","เกียรติธนากร",""
"Mr","นายพจนารถ แสงพฤกษ์","พจนารถ","แสงพฤกษ์",""
"Dr","ดร. วิชัย ณรงค์วณิชย์","วิชัย","ณรงค์วณิชย์",""
"Mrs","นางกิติยา ฤกษ์ภูริทัต","กิติยา","ฤกษ์ภูริทัต",""
"Mr","นายวรวิทย์ เกียรติทวีอนันต์","วรวิทย์","เกียรติทวีอนันต์",""
"Ms","นางสาววาสนา สุระกิจ","วาสนา","สุระกิจ",""
"Mr","นายกิตติพงศ์ คุ้มมั่น","กิตติพงศ์","คุ้มมั่น",""
"Ms","นางสาวมณฑา วรประสิทธิ์","มณฑา","วรประสิทธิ์",""
"Ms","นางสาวสวคนธ์ เมฆาสวัสดิ์","สวคนธ์","เมฆาสวัสดิ์",""
"","​นายปรัชญา เกิดแก้วฟ้า","​นายปรัชญา","เกิดแก้วฟ้า",""
"Mr","นายเมธี พรรณเชษฐ์","เมธี","พรรณเชษฐ์",""
"Ms","นางสาวจริภรณ์ กิจเจริญไพศาล","จริภรณ์","กิจเจริญไพศาล",""
"Ms","นางสาวจิตราวิณี วรรณกร","จิตราวิณี","วรรณกร",""
"Mr","นายณพวิทย์ โทเทอดวิไล","ณพวิทย์","โทเทอดวิไล",""
"Ms","นางสาวณัชชา อากาศฤกษ์","ณัชชา","อากาศฤกษ์",""
"Mrs","นางนลินรัตน์ ทรรทรานนท์","นลินรัตน์","ทรรทรานนท์",""
"Mr","นายปัญญา คงคาไพศาล","ปัญญา","คงคาไพศาล",""
"Mr","นายไพศาล วรเศรษฐ์ศิริ","ไพศาล","วรเศรษฐ์ศิริ",""
"Dr","ดร. สรรเพชญ สุขเพสน์","สรรเพชญ","สุขเพสน์",""
"Mrs","นางสุนันท์ ศิริอักษร","สุนันท์","ศิริอักษร",""
"Mr","นายสุรพงษ์ ศิวาลัย","สุรพงษ์","ศิวาลัย",""
"Dr","ดร.อนุวรรตน์ ศรีอุดม","อนุวรรตน์","ศรีอุดม",""
"Mr","นายวรวุฒิ เวสารัชกิจ","วรวุฒิ","เวสารัชกิจ",""
"Mr","นายสรุจ วนรัตน์ศิริกุล","สรุจ","วนรัตน์ศิริกุล",""
"Mr","นายชัยยศ ตันพิสุทธิ์","ชัยยศ","ตันพิสุทธิ์",""
"Mrs","นางอุษา เกาศล","อุษา","เกาศล",""
"Mr","นายสิทธิโชค เตชพาหพงษ์","สิทธิโชค","เตชพาหพงษ์",""
"Mr","นายรักษภาส วิชินโรจน์จรัล","รักษภาส","วิชินโรจน์จรัล",""
"Mrs","นางสาธินี ศรีรัตนพงษ์","สาธินี","ศรีรัตนพงษ์",""
"Ms","นางสาวชนกสุดา ชิตรัตน์","ชนกสุดา","ชิตรัตน์",""
"Ms","นางสาวชุติมา กิตติบัณฑูร","ชุติมา","กิตติบัณฑูร",""
"Ms","นางสาวนันทิกา ศันสนียเกียรติ","นันทิกา","ศันสนียเกียรติ",""
"Ms","นางสาวบุญวรงค์ บุณยไวโรจน์","บุญวรงค์","บุณยไวโรจน์",""
"Mrs","นางวราลักษณ์ อภิกุลวณิช","วราลักษณ์","อภิกุลวณิช",""
"Mr","นายสรศักดิ์ พึ่งรัตน์","สรศักดิ์","พึ่งรัตน์",""
"Mr","นายสิริพัฒน์ อรรฆย์ศุภกุล","สิริพัฒน์","อรรฆย์ศุภกุล",""
"Ms","นางสาวอรธิดา บุญเปี่ยมศักดิ์","อรธิดา","บุญเปี่ยมศักดิ์",""
"Ms","นางสาวอาภรณ์ ศิริศรีสกุลชัย","อาภรณ์","ศิริศรีสกุลชัย",""
"Ms","นางสาวศิริพร เริงจิตต์","ศิริพร","เริงจิตต์",""
"Mr","นายกุลวัชร์ พุ่มเทียน","กุลวัชร์","พุ่มเทียน",""
"Mr","นายจักรพงศ์ โอแสงธรรมนนท์","จักรพงศ์","โอแสงธรรมนนท์",""
"Mr","นายรวินท์ เบญจตันติกุล","รวินท์","เบญจตันติกุล",""
"Mr","นายรุ่งสกุล เรืองไทย","รุ่งสกุล","เรืองไทย",""
"Dr","ดร.วราธัช ตันติวรวงศ์","วราธัช","ตันติวรวงศ์",""
"Mr","นายศิริวัฒน์ วิศลดิลกพันธ์","ศิริวัฒน์","วิศลดิลกพันธ์",""
"Mr","นายสมพร วงศ์ประคอง","สมพร","วงศ์ประคอง",""
"Mr","นายสิริพล จิตรจง","สิริพล","จิตรจง",""
"Mr","นายกำพล สุทธิพิเชษฐ์","กำพล","สุทธิพิเชษฐ์",""
"Mr","นายธีระเดช ตันไพบูลย์","ธีระเดช","ตันไพบูลย์",""
"Mr","นายบวร ศรีสง่าตระกูล","บวร","ศรีสง่าตระกูล",""
"Mr","นายบุญเติบ จีรภัทร์","บุญเติบ","จีรภัทร์",""
"Mrs","นางพิภาพัณณ์ อรรถวานิช","พิภาพัณณ์","อรรถวานิช",""
"Mrs","นางภัทราภา หงษ์คำดี","ภัทราภา","หงษ์คำดี",""
"Mr","นายภาสกร อรพนิชอารี","ภาสกร","อรพนิชอารี",""
"Ms","นางสาวร่มฉัตร ทรงศิริ","ร่มฉัตร","ทรงศิริ",""
"Mr","นายวีระพล บดีรัฐ","วีระพล","บดีรัฐ",""
"Mr","นายสุขสันต์ วัฒนายากร","สุขสันต์","วัฒนายากร",""
"Dr","ดร.ดลินี ศาสตระรุจิ","ดลินี","ศาสตระรุจิ",""
"Dr","ดร.บุริศวร์ กิตติรังสิ","บุริศวร์","กิตติรังสิ",""
"Ms","นางสาวพัชรี จำนง","พัชรี","จำนง",""
"Mr","นายอรรถสิทธิ์ เอื้ออารักษ์","อรรถสิทธิ์","เอื้ออารักษ์",""
"Mr","นายอุดร อุปเส็น","อุดร","อุปเส็น",""
"Ms","นางสาวชิพาภัสร์ ศรีนครไทย","ชิพาภัสร์","ศรีนครไทย",""
"Ms","นางสาวรวีวรรณ มูลทรัพย์","รวีวรรณ","มูลทรัพย์",""
"Mr","นายปิยะพงศ์ แสงภัทราชัย","ปิยะพงศ์","แสงภัทราชัย",""
"Mr","นายพงศกร ล่ำซำ","พงศกร","ล่ำซำ",""
"Dr","ดร. ตรีพล ภูมิวสนะ","ตรีพล","ภูมิวสนะ",""
"Ms","นางสาวศิริพร สุวรรณการ","ศิริพร","สุวรรณการ",""
"Mr","นายพีระพัฒน์ เหรียญประยูร","พีระพัฒน์","เหรียญประยูร",""
"Ms","นางสาวสุใจ หาญเชาว์วงศ์","สุใจ","หาญเชาว์วงศ์",""
"Ms","นางสาวพรวิภา ตั้งตรงจิตร","พรวิภา","ตั้งตรงจิตร",""
"Mr","นายสาวิตร ศรีศรันยพงศ์","สาวิตร","ศรีศรันยพงศ์",""
